{
  "schema": "afi.pipeline-template.v1",
  "templateId": "fixed-minimal",
  "templateVersion": "v1.0.0",
  "parameters": [],
  "pipelineId": "minimal-linear",
  "pipelineVersion": "v1.0.0",
  "entry": "tech",
  "nodes": [
    {
      "id": "tech",
      "category": "technical",
      "pluginId": "technical-indicators",
      "pluginVersion": "1.0.0"
    },
    {
      "id": "score",
      "category": "scorer",
      "pluginId": "mean-reversion-scorer",
      "pluginVersion": "1.0.0"
    }
  ],
  "edges": [
    {
      "from": "tech",
      "to": "score"
    }
  ]
}
